microbench/result.csv
Problem,Provider,OperationKind,Operation,Disposition,Status,gemm_kind,m,n,k,A,B,C,D,alpha,beta,split_k_mode,split_k_slices,batch_count,raster_order,runtime_input_datatype_a,runtime_input_datatype_b,use_pdl,enable_sm90_mixed_dtype_shuffle_test,swizzle_size,op_class,accum,cta_m,cta_n,cta_k,cluster_m,cluster_n,cluster_k,cluster_m_fallback,cluster_n_fallback,cluster_k_fallback,stages,warps_m,warps_n,warps_k,inst_m,inst_n,inst_k,min_cc,max_cc,Bytes,Flops,Flops/Byte,Runtime,GB/s,GFLOPs
1,CUTLASS,gemm,cutlass_tensorop_s1688gemm_f16_64x64_32x2_nn_align1,passed,success,universal,1,1,16,f16:column,f16:column,f32:column,f32:column,1,0,serial,1,1,heuristic,invalid,invalid,False,False,1,tensorop,f32,64,64,32,1,1,1,0,0,0,2,2,2,1,16,8,8,75,1024,68,34,0,0.00483328,0.0131029,0.00703456
257,CUTLASS,gemm,cutlass_tensorop_s1688gemm_f16_64x64_32x2_nn_align1,passed,success,universal,1,1,32,f16:column,f16:column,f32:column,f32:column,1,0,serial,1,1,heuristic,invalid,invalid,False,False,1,tensorop,f32,64,64,32,1,1,1,0,0,0,2,2,2,1,16,8,8,75,1024,132,66,0,0.00467968,0.0262699,0.0141035
513,CUTLASS,gemm,cutlass_tensorop_s1688gemm_f16_64x64_32x2_nn_align1,passed,success,universal,1,1,64,f16:column,f16:column,f32:column,f32:column,1,0,serial,1,1,heuristic,invalid,invalid,False,False,1,tensorop,f32,64,64,32,1,1,1,0,0,0,2,2,2,1,16,8,8,75,1024,260,130,0,0.00504832,0.0479652,0.0257511
769,CUTLASS,gemm,cutlass_tensorop_s1688gemm_f16_64x64_32x2_nn_align1,passed,success,universal,1,1,128,f16:column,f16:column,f32:column,f32:column,1,0,serial,1,1,heuristic,invalid,invalid,False,False,1,tensorop,f32,64,64,32,1,1,1,0,0,0,2,2,2,1,16,8,8,75,1024,516,258,0,0.0059904,0.0802221,0.0430689
1025,CUTLASS,gemm,cutlass_tensorop_s1688gemm_f16_64x64_32x2_nn_align1,passed,success,universal,1,1,256,f16:column,f16:column,f32:column,f32:column,1,0,serial,1,1,heuristic,invalid,invalid,False,False,1,tensorop,f32,64,64,32,1,1,1,0,0,0,2,2,2,1,16,8,8,75,1024,1028,514,0,0.00794624,0.120485,0.0646847
1281,CUTLASS,gemm,cutlass_tensorop_s1688gemm_f16_64x64_32x2_nn_align1,passed,success,universal,1,1,512,f16:column,f16:column,f32:column,f32:column,1,0,serial,1,1,heuristic,invalid,invalid,False,False,1,tensorop,f32,64,64,32,1,1,1,0,0,0,2,2,2,1,16,8,8,75,1024,2052,1026,0,0.0125235,0.152599,0.0819258
1537,CUTLASS,gemm,cutlass_tensorop_s1688gemm_f16_64x64_32x2_nn_align1,passed,success,universal,1,1,1024,f16:column,f16:column,f32:column,f32:column,1,0,serial,1,1,heuristic,invalid,invalid,False,False,1,tensorop,f32,64,64,32,1,1,1,0,0,0,2,2,2,1,16,8,8,75,1024,4100,2050,0,0.0205312,0.185981,0.099848
1793,CUTLASS,gemm,cutlass_tensorop_s1688gemm_f16_64x64_32x2_nn_align1,passed,success,universal,1,1,2048,f16:column,f16:column,f32:column,f32:column,1,0,serial,1,1,heuristic,invalid,invalid,False,False,1,tensorop,f32,64,64,32,1,1,1,0,0,0,2,2,2,1,16,8,8,75,1024,8196,4098,0,0.0364954,0.209153,0.112288
2049,CUTLASS,gemm,cutlass_tensorop_s1688gemm_f16_64x64_32x2_nn_align1,passed,success,universal,1,1,4096,f16:column,f16:column,f32:column,f32:column,1,0,serial,1,1,heuristic,invalid,invalid,False,False,1,tensorop,f32,64,64,32,1,1,1,0,0,0,2,2,2,1,16,8,8,75,1024,16388,8194,0,0.0681984,0.223796,0.120149
257,CUTLASS,gemm,cutlass_tensorop_s1688gemm_f16_64x64_32x2_nn_align1,passed,success,universal,1,1,8192,f16:column,f16:column,f32:column,f32:column,1,0,serial,1,1,heuristic,invalid,invalid,False,False,1,tensorop,f32,64,64,32,1,1,1,0,0,0,2,2,2,1,16,8,8,75,1024,32772,16386,0,0.13652,0.223567,0.120027
513,CUTLASS,gemm,cutlass_tensorop_s1688gemm_f16_64x64_32x2_nn_align1,passed,success,universal,1,1,12288,f16:column,f16:column,f32:column,f32:column,1,0,serial,1,1,heuristic,invalid,invalid,False,False,1,tensorop,f32,64,64,32,1,1,1,0,0,0,2,2,2,1,16,8,8,75,1024,49156,24578,0,0.19841,0.230735,0.123875
769,CUTLASS,gemm,cutlass_tensorop_s1688gemm_f16_64x64_32x2_nn_align1,passed,success,universal,1,1,16384,f16:column,f16:column,f32:column,f32:column,1,0,serial,1,1,heuristic,invalid,invalid,False,False,1,tensorop,f32,64,64,32,1,1,1,0,0,0,2,2,2,1,16,8,8,75,1024,65540,32770,0,0.265728,0.229704,0.123322
17,CUTLASS,gemm,cutlass_tensorop_s1688gemm_f16_64x64_32x2_nn_align1,passed,success,universal,1,2,16,f16:column,f16:column,f32:column,f32:column,1,0,serial,1,1,heuristic,invalid,invalid,False,False,1,tensorop,f32,64,64,32,1,1,1,0,0,0,2,2,2,1,16,8,8,75,1024,104,68,0,0.00439296,0.0220484,0.0154793
273,CUTLASS,gemm,cutlass_tensorop_s1688gemm_f16_64x64_32x2_nn_align1,passed,success,universal,1,2,32,f16:column,f16:column,f32:column,f32:column,1,0,serial,1,1,heuristic,invalid,invalid,False,False,1,tensorop,f32,64,64,32,1,1,1,0,0,0,2,2,2,1,16,8,8,75,1024,200,132,0,0.00497664,0.0374278,0.0265239
529,CUTLASS,gemm,cutlass_tensorop_s1688gemm_f16_64x64_32x2_nn_align1,passed,success,universal,1,2,64,f16:column,f16:column,f32:column,f32:column,1,0,serial,1,1,heuristic,invalid,invalid,False,False,1,tensorop,f32,64,64,32,1,1,1,0,0,0,2,2,2,1,16,8,8,75,1024,392,260,0,0.00505856,0.0721704,0.051398
785,CUTLASS,gemm,cutlass_tensorop_s1688gemm_f16_64x64_32x2_nn_align1,passed,success,universal,1,2,128,f16:column,f16:column,f32:column,f32:column,1,0,serial,1,1,heuristic,invalid,invalid,False,False,1,tensorop,f32,64,64,32,1,1,1,0,0,0,2,2,2,1,16,8,8,75,1024,776,516,0,0.00642048,0.112563,0.0803678
1041,CUTLASS,gemm,cutlass_tensorop_s1688gemm_f16_64x64_32x2_nn_align1,passed,success,universal,1,2,256,f16:column,f16:column,f32:column,f32:column,1,0,serial,1,1,heuristic,invalid,invalid,False,False,1,tensorop,f32,64,64,32,1,1,1,0,0,0,2,2,2,1,16,8,8,75,1024,1544,1028,0,0.00835584,0.172091,0.123028
1297,CUTLASS,gemm,cutlass_tensorop_s1688gemm_f16_64x64_32x2_nn_align1,passed,success,universal,1,2,512,f16:column,f16:column,f32:column,f32:column,1,0,serial,1,1,heuristic,invalid,invalid,False,False,1,tensorop,f32,64,64,32,1,1,1,0,0,0,2,2,2,1,16,8,8,75,1024,3080,2052,0,0.0121344,0.236392,0.169106
1553,CUTLASS,gemm,cutlass_tensorop_s1688gemm_f16_64x64_32x2_nn_align1,passed,success,universal,1,2,1024,f16:column,f16:column,f32:column,f32:column,1,0,serial,1,1,heuristic,invalid,invalid,False,False,1,tensorop,f32,64,64,32,1,1,1,0,0,0,2,2,2,1,16,8,8,75,1024,6152,4100,0,0.0209306,0.273738,0.195886
1809,CUTLASS,gemm,cutlass_tensorop_s1688gemm_f16_64x64_32x2_nn_align1,passed,success,universal,1,2,2048,f16:column,f16:column,f32:column,f32:column,1,0,serial,1,1,heuristic,invalid,invalid,False,False,1,tensorop,f32,64,64,32,1,1,1,0,0,0,2,2,2,1,16,8,8,75,1024,12296,8196,0,0.03712,0.308501,0.220797
2065,CUTLASS,gemm,cutlass_tensorop_s1688gemm_f16_64x64_32x2_nn_align1,passed,success,universal,1,2,4096,f16:column,f16:column,f32:column,f32:column,1,0,serial,1,1,heuristic,invalid,invalid,False,False,1,tensorop,f32,64,64,32,1,1,1,0,0,0,2,2,2,1,16,8,8,75,1024,24584,16388,0,0.0722125,0.317059,0.226941
273,CUTLASS,gemm,cutlass_tensorop_s1688gemm_f16_64x64_32x2_nn_align1,passed,success,universal,1,2,8192,f16:column,f16:column,f32:column,f32:column,1,0,serial,1,1,heuristic,invalid,invalid,False,False,1,tensorop,f32,64,64,32,1,1,1,0,0,0,2,2,2,1,16,8,8,75,1024,49160,32772,0,0.136212,0.336121,0.240595
529,CUTLASS,gemm,cutlass_tensorop_s1688gemm_f16_64x64_32x2_nn_align1,passed,success,universal,1,2,12288,f16:column,f16:column,f32:column,f32:column,1,0,serial,1,1,heuristic,invalid,invalid,False,False,1,tensorop,f32,64,64,32,1,1,1,0,0,0,2,2,2,1,16,8,8,75,1024,73736,49156,0,0.207964,0.330211,0.236368
785,CUTLASS,gemm,cutlass_tensorop_s1688gemm_f16_64x64_32x2_nn_align1,passed,success,universal,1,2,16384,f16:column,f16:column,f32:column,f32:column,1,0,serial,1,1,heuristic,invalid,invalid,False,False,1,tensorop,f32,64,64,32,1,1,1,0,0,0,2,2,2,1,16,8,8,75,1024,98312,65540,0,0.268841,0.340574,0.243787
33,CUTLASS,gemm,cutlass_tensorop_s1688gemm_f16_64x64_32x2_nn_align1,passed,success,universal,1,4,16,f16:column,f16:column,f32:column,f32:column,1,0,serial,1,1,heuristic,invalid,invalid,False,False,1,tensorop,f32,64,64,32,1,1,1,0,0,0,2,2,2,1,16,8,8,75,1024,176,136,0,0.00451584,0.0362973,0.0301162
289,CUTLASS,gemm,cutlass_tensorop_s1688gemm_f16_64x64_32x2_nn_align1,passed,success,universal,1,4,32,f16:column,f16:column,f32:column,f32:column,1,0,serial,1,1,heuristic,invalid,invalid,False,False,1,tensorop,f32,64,64,32,1,1,1,0,0,0,2,2,2,1,16,8,8,75,1024,336,264,0,0.00461824,0.0677584,0.0571646
545,CUTLASS,gemm,cutlass_tensorop_s1688gemm_f16_64x64_32x2_nn_align1,passed,success,universal,1,4,64,f16:column,f16:column,f32:column,f32:column,1,0,serial,1,1,heuristic,invalid,invalid,False,False,1,tensorop,f32,64,64,32,1,1,1,0,0,0,2,2,2,1,16,8,8,75,1024,656,520,0,0.00493568,0.123782,0.105355
801,CUTLASS,gemm,cutlass_tensorop_s1688gemm_f16_64x64_32x2_nn_align1,passed,success,universal,1,4,128,f16:column,f16:column,f32:column,f32:column,1,0,serial,1,1,heuristic,invalid,invalid,False,False,1,tensorop,f32,64,64,32,1,1,1,0,0,0,2,2,2,1,16,8,8,75,1024,1296,1032,0,0.00635904,0.189808,0.162289
1057,CUTLASS,gemm,cutlass_tensorop_s1688gemm_f16_64x64_32x2_nn_align1,passed,success,universal,1,4,256,f16:column,f16:column,f32:column,f32:column,1,0,serial,1,1,heuristic,invalid,invalid,False,False,1,tensorop,f32,64,64,32,1,1,1,0,0,0,2,2,2,1,16,8,8,75,1024,2576,2056,0,0.00848896,0.282613,0.242197
1313,CUTLASS,gemm,cutlass_tensorop_s1688gemm_f16_64x64_32x2_nn_align1,passed,success,universal,1,4,512,f16:column,f16:column,f32:column,f32:column,1,0,serial,1,1,heuristic,invalid,invalid,False,False,1,tensorop,f32,64,64,32,1,1,1,0,0,0,2,2,2,1,16,8,8,75,1024,5136,4104,0,0.012329,0.387971,0.332875
1569,CUTLASS,gemm,cutlass_tensorop_s1688gemm_f16_64x64_32x2_nn_align1,passed,success,universal,1,4,1024,f16:column,f16:column,f32:column,f32:column,1,0,serial,1,1,heuristic,invalid,invalid,False,False,1,tensorop,f32,64,64,32,1,1,1,0,0,0,2,2,2,1,16,8,8,75,1024,10256,8200,0,0.0213299,0.447805,0.384437
1825,CUTLASS,gemm,cutlass_tensorop_s1688gemm_f16_64x64_32x2_nn_align1,passed,success,universal,1,4,2048,f16:column,f16:column,f32:column,f32:column,1,0,serial,1,1,heuristic,invalid,invalid,False,False,1,tensorop,f32,64,64,32,1,1,1,0,0,0,2,2,2,1,16,8,8,75,1024,20496,16392,0,0.0392909,0.485822,0.417196
33,CUTLASS,gemm,cutlass_tensorop_s1688gemm_f16_64x64_32x2_nn_align1,passed,success,universal,1,4,4096,f16:column,f16:column,f32:column,f32:column,1,0,serial,1,1,heuristic,invalid,invalid,False,False,1,tensorop,f32,64,64,32,1,1,1,0,0,0,2,2,2,1,16,8,8,75,1024,40976,32776,0,0.0741171,0.514886,0.442219
289,CUTLASS,gemm,cutlass_tensorop_s1688gemm_f16_64x64_32x2_nn_align1,passed,success,universal,1,4,8192,f16:column,f16:column,f32:column,f32:column,1,0,serial,1,1,heuristic,invalid,invalid,False,False,1,tensorop,f32,64,64,32,1,1,1,0,0,0,2,2,2,1,16,8,8,75,1024,81936,65544,0,0.139663,0.546377,0.4693
545,CUTLASS,gemm,cutlass_tensorop_s1688gemm_f16_64x64_32x2_nn_align1,passed,success,universal,1,4,12288,f16:column,f16:column,f32:column,f32:column,1,0,serial,1,1,heuristic,invalid,invalid,False,False,1,tensorop,f32,64,64,32,1,1,1,0,0,0,2,2,2,1,16,8,8,75,1024,122896,98312,0,0.213514,0.536057,0.460447
801,CUTLASS,gemm,cutlass_tensorop_s1688gemm_f16_64x64_32x2_nn_align1,passed,success,universal,1,4,16384,f16:column,f16:column,f32:column,f32:column,1,0,serial,1,1,heuristic,invalid,invalid,False,False,1,tensorop,f32,64,64,32,1,1,1,0,0,0,2,2,2,1,16,8,8,75,1024,163856,131080,0,0.273725,0.557503,0.478874
49,CUTLASS,gemm,cutlass_tensorop_s1688gemm_f16_64x64_32x2_nn_align1,passed,success,universal,1,8,16,f16:column,f16:column,f32:column,f32:column,1,0,serial,1,1,heuristic,invalid,invalid,False,False,1,tensorop,f32,64,64,32,1,1,1,0,0,0,2,2,2,1,16,8,8,75,1024,320,272,0,0.00494592,0.0602564,0.0549948
305,CUTLASS,gemm,cutlass_tensorop_s1688gemm_f16_64x64_32x2_nn_align1,passed,success,universal,1,8,32,f16:column,f16:column,f32:column,f32:column,1,0,serial,1,1,heuristic,invalid,invalid,False,False,1,tensorop,f32,64,64,32,1,1,1,0,0,0,2,2,2,1,16,8,8,75,1024,608,528,0,0.004864,0.116415,0.108553
561,CUTLASS,gemm,cutlass_tensorop_s1688gemm_f16_64x64_32x2_nn_align1,passed,success,universal,1,8,64,f16:column,f16:column,f32:column,f32:column,1,0,serial,1,1,heuristic,invalid,invalid,False,False,1,tensorop,f32,64,64,32,1,1,1,0,0,0,2,2,2,1,16,8,8,75,1024,1184,1040,0,0.00544768,0.202414,0.190907
817,CUTLASS,gemm,cutlass_tensorop_s1688gemm_f16_64x64_32x2_nn_align1,passed,success,universal,1,8,128,f16:column,f16:column,f32:column,f32:column,1,0,serial,1,1,heuristic,invalid,invalid,False,False,1,tensorop,f32,64,64,32,1,1,1,0,0,0,2,2,2,1,16,8,8,75,1024,2336,2064,0,0.006144,0.354097,0.335937
1073,CUTLASS,gemm,cutlass_tensorop_s1688gemm_f16_64x64_32x2_nn_align1,passed,success,universal,1,8,256,f16:column,f16:column,f32:column,f32:column,1,0,serial,1,1,heuristic,invalid,invalid,False,False,1,tensorop,f32,64,64,32,1,1,1,0,0,0,2,2,2,1,16,8,8,75,1024,4640,4112,0,0.00858112,0.503587,0.479192
1329,CUTLASS,gemm,cutlass_tensorop_s1688gemm_f16_64x64_32x2_nn_align1,passed,success,universal,1,8,512,f16:column,f16:column,f32:column,f32:column,1,0,serial,1,1,heuristic,invalid,invalid,False,False,1,tensorop,f32,64,64,32,1,1,1,0,0,0,2,2,2,1,16,8,8,75,1024,9248,8208,0,0.0129843,0.663329,0.632147
1585,CUTLASS,gemm,cutlass_tensorop_s1688gemm_f16_64x64_32x2_nn_align1,passed,success,universal,1,8,1024,f16:column,f16:column,f32:column,f32:column,1,0,serial,1,1,heuristic,invalid,invalid,False,False,1,tensorop,f32,64,64,32,1,1,1,0,0,0,2,2,2,1,16,8,8,75,1024,18464,16400,0,0.0226202,0.760204,0.725017
1841,CUTLASS,gemm,cutlass_tensorop_s1688gemm_f16_64x64_32x2_nn_align1,passed,success,universal,1,8,2048,f16:column,f16:column,f32:column,f32:column,1,0,serial,1,1,heuristic,invalid,invalid,False,False,1,tensorop,f32,64,64,32,1,1,1,0,0,0,2,2,2,1,16,8,8,75,1024,36896,32784,0,0.0406835,0.844619,0.80583
2097,CUTLASS,gemm,cutlass_tensorop_s1688gemm_f16_64x64_32x2_nn_align1,passed,success,universal,1,8,4096,f16:column,f16:column,f32:column,f32:column,1,0,serial,1,1,heuristic,invalid,invalid,False,False,1,tensorop,f32,64,64,32,1,1,1,0,0,0,2,2,2,1,16,8,8,75,1024,73760,65552,0,0.0768,0.894458,0.853542
305,CUTLASS,gemm,cutlass_tensorop_s1688gemm_f16_64x64_32x2_nn_align1,passed,success,universal,1,8,8192,f16:column,f16:column,f32:column,f32:column,1,0,serial,1,1,heuristic,invalid,invalid,False,False,1,tensorop,f32,64,64,32,1,1,1,0,0,0,2,2,2,1,16,8,8,75,1024,147488,131088,0,0.143493,0.957251,0.913549
561,CUTLASS,gemm,cutlass_tensorop_s1688gemm_f16_64x64_32x2_nn_align1,passed,success,universal,1,8,12288,f16:column,f16:column,f32:column,f32:column,1,0,serial,1,1,heuristic,invalid,invalid,False,False,1,tensorop,f32,64,64,32,1,1,1,0,0,0,2,2,2,1,16,8,8,75,1024,221216,196624,0,0.222249,0.926994,0.884702
817,CUTLASS,gemm,cutlass_tensorop_s1688gemm_f16_64x64_32x2_nn_align1,passed,success,universal,1,8,16384,f16:column,f16:column,f32:column,f32:column,1,0,serial,1,1,heuristic,invalid,invalid,False,False,1,tensorop,f32,64,64,32,1,1,1,0,0,0,2,2,2,1,16,8,8,75,1024,294944,262160,0,0.292751,0.938298,0.895504
65,CUTLASS,gemm,cutlass_tensorop_s1688gemm_f16_64x64_32x2_nn_align1,passed,success,universal,1,16,16,f16:column,f16:column,f32:column,f32:column,1,0,serial,1,1,heuristic,invalid,invalid,False,False,1,tensorop,f32,64,64,32,1,1,1,0,0,0,2,2,2,1,16,8,8,75,1024,608,544,0,0.00484352,0.116908,0.112315
321,CUTLASS,gemm,cutlass_tensorop_s1688gemm_f16_64x64_32x2_nn_align1,passed,success,universal,1,16,32,f16:column,f16:column,f32:column,f32:column,1,0,serial,1,1,heuristic,invalid,invalid,False,False,1,tensorop,f32,64,64,32,1,1,1,0,0,0,2,2,2,1,16,8,8,75,1024,1152,1056,0,0.00446464,0.240307,0.236525
577,CUTLASS,gemm,cutlass_tensorop_s1688gemm_f16_64x64_32x2_nn_align1,passed,success,universal,1,16,64,f16:column,f16:column,f32:column,f32:column,1,0,serial,1,1,heuristic,invalid,invalid,False,False,1,tensorop,f32,64,64,32,1,1,1,0,0,0,2,2,2,1,16,8,8,75,1024,2240,2080,0,0.00551936,0.377972,0.376855
833,CUTLASS,gemm,cutlass_tensorop_s1688gemm_f16_64x64_32x2_nn_align1,passed,success,universal,1,16,128,f16:column,f16:column,f32:column,f32:column,1,0,serial,1,1,heuristic,invalid,invalid,False,False,1,tensorop,f32,64,64,32,1,1,1,0,0,0,2,2,2,1,16,8,8,75,1024,4416,4128,0,0.00631808,0.650945,0.653363
1089,CUTLASS,gemm,cutlass_tensorop_s1688gemm_f16_64x64_32x2_nn_align1,passed,success,universal,1,16,256,f16:column,f16:column,f32:column,f32:column,1,0,serial,1,1,heuristic,invalid,invalid,False,False,1,tensorop,f32,64,64,32,1,1,1,0,0,0,2,2,2,1,16,8,8,75,1024,8768,8224,0,0.0091648,0.891,0.897346
1345,CUTLASS,gemm,cutlass_tensorop_s1688gemm_f16_64x64_32x2_nn_align1,passed,success,universal,1,16,512,f16:column,f16:column,f32:column,f32:column,1,0,serial,1,1,heuristic,invalid,invalid,False,False,1,tensorop,f32,64,64,32,1,1,1,0,0,0,2,2,2,1,16,8,8,75,1024,17472,16416,0,0.0143667,1.13262,1.14264
1601,CUTLASS,gemm,cutlass_tensorop_s1688gemm_f16_64x64_32x2_nn_align1,passed,success,universal,1,16,1024,f16:column,f16:column,f32:column,f32:column,1,0,serial,1,1,heuristic,invalid,invalid,False,False,1,tensorop,f32,64,64,32,1,1,1,0,0,0,2,2,2,1,16,8,8,75,1024,34880,32800,0,0.0244429,1.329,1.3419
1857,CUTLASS,gemm,cutlass_tensorop_s1688gemm_f16_64x64_32x2_nn_align1,passed,success,universal,1,16,2048,f16:column,f16:column,f32:column,f32:column,1,0,serial,1,1,heuristic,invalid,invalid,False,False,1,tensorop,f32,64,64,32,1,1,1,0,0,0,2,2,2,1,16,8,8,75,1024,69696,65568,0,0.0449843,1.44294,1.45757
2113,CUTLASS,gemm,cutlass_tensorop_s1688gemm_f16_64x64_32x2_nn_align1,passed,success,universal,1,16,4096,f16:column,f16:column,f32:column,f32:column,1,0,serial,1,1,heuristic,invalid,invalid,False,False,1,tensorop,f32,64,64,32,1,1,1,0,0,0,2,2,2,1,16,8,8,75,1024,139328,131104,0,0.0854835,1.51795,1.53368
321,CUTLASS,gemm,cutlass_tensorop_s1688gemm_f16_64x64_32x2_nn_align1,passed,success,universal,1,16,8192,f16:column,f16:column,f32:column,f32:column,1,0,serial,1,1,heuristic,invalid,invalid,False,False,1,tensorop,f32,64,64,32,1,1,1,0,0,0,2,2,2,1,16,8,8,75,1024,278592,262176,0,0.166523,1.5581,1.57441
577,CUTLASS,gemm,cutlass_tensorop_s1688gemm_f16_64x64_32x2_nn_align1,passed,success,universal,1,16,12288,f16:column,f16:column,f32:column,f32:column,1,0,serial,1,1,heuristic,invalid,invalid,False,False,1,tensorop,f32,64,64,32,1,1,1,0,0,0,2,2,2,1,16,8,8,75,1024,417856,393248,0,0.250941,1.55079,1.56709
833,CUTLASS,gemm,cutlass_tensorop_s1688gemm_f16_64x64_32x2_nn_align1,passed,success,universal,1,16,16384,f16:column,f16:column,f32:column,f32:column,1,0,serial,1,1,heuristic,invalid,invalid,False,False,1,tensorop,f32,64,64,32,1,1,1,0,0,0,2,2,2,1,16,8,8,75,1024,557120,524320,0,0.330578,1.56955,1.58607
81,CUTLASS,gemm,cutlass_tensorop_s1688gemm_f16_64x64_32x2_nn_align1,passed,success,universal,1,32,16,f16:column,f16:column,f32:column,f32:column,1,0,serial,1,1,heuristic,invalid,invalid,False,False,1,tensorop,f32,64,64,32,1,1,1,0,0,0,2,2,2,1,16,8,8,75,1024,1184,1088,0,0.0049664,0.222029,0.219072
337,CUTLASS,gemm,cutlass_tensorop_s1688gemm_f16_64x64_32x2_nn_align1,passed,success,universal,1,32,32,f16:column,f16:column,f32:column,f32:column,1,0,serial,1,1,heuristic,invalid,invalid,False,False,1,tensorop,f32,64,64,32,1,1,1,0,0,0,2,2,2,1,16,8,8,75,1024,2240,2112,0,0.00497664,0.419191,0.424383
593,CUTLASS,gemm,cutlass_tensorop_s1688gemm_f16_64x64_32x2_nn_align1,passed,success,universal,1,32,64,f16:column,f16:column,f32:column,f32:column,1,0,serial,1,1,heuristic,invalid,invalid,False,False,1,tensorop,f32,64,64,32,1,1,1,0,0,0,2,2,2,1,16,8,8,75,1024,4352,4160,0,0.0053248,0.761177,0.78125
849,CUTLASS,gemm,cutlass_tensorop_s1688gemm_f16_64x64_32x2_nn_align1,passed,success,universal,1,32,128,f16:column,f16:column,f32:column,f32:column,1,0,serial,1,1,heuristic,invalid,invalid,False,False,1,tensorop,f32,64,64,32,1,1,1,0,0,0,2,2,2,1,16,8,8,75,1024,8576,8256,0,0.00672768,1.18719,1.22717
1105,CUTLASS,gemm,cutlass_tensorop_s1688gemm_f16_64x64_32x2_nn_align1,passed,success,universal,1,32,256,f16:column,f16:column,f32:column,f32:column,1,0,serial,1,1,heuristic,invalid,invalid,False,False,1,tensorop,f32,64,64,32,1,1,1,0,0,0,2,2,2,1,16,8,8,75,1024,17024,16448,0,0.00973824,1.6281,1.68901
1361,CUTLASS,gemm,cutlass_tensorop_s1688gemm_f16_64x64_32x2_nn_align1,passed,success,universal,1,32,512,f16:column,f16:column,f32:column,f32:column,1,0,serial,1,1,heuristic,invalid,invalid,False,False,1,tensorop,f32,64,64,32,1,1,1,0,0,0,2,2,2,1,16,8,8,75,1024,33920,32832,0,0.0159232,1.98393,2.0619
1617,CUTLASS,gemm,cutlass_tensorop_s1688gemm_f16_64x64_32x2_nn_align1,passed,success,universal,1,32,1024,f16:column,f16:column,f32:column,f32:column,1,0,serial,1,1,heuristic,invalid,invalid,False,False,1,tensorop,f32,64,64,32,1,1,1,0,0,0,2,2,2,1,16,8,8,75,1024,67712,65600,0,0.0276173,2.28342,2.37532
1873,CUTLASS,gemm,cutlass_tensorop_s1688gemm_f16_64x64_32x2_nn_align1,passed,success,universal,1,32,2048,f16:column,f16:column,f32:column,f32:column,1,0,serial,1,1,heuristic,invalid,invalid,False,False,1,tensorop,f32,64,64,32,1,1,1,0,0,0,2,2,2,1,16,8,8,75,1024,135296,131136,0,0.050391,2.50053,2.60237
2129,CUTLASS,gemm,cutlass_tensorop_s1688gemm_f16_64x64_32x2_nn_align1,passed,success,universal,1,32,4096,f16:column,f16:column,f32:column,f32:column,1,0,serial,1,1,heuristic,invalid,invalid,False,False,1,tensorop,f32,64,64,32,1,1,1,0,0,0,2,2,2,1,16,8,8,75,1024,270464,262208,0,0.0968192,2.60165,2.70822
337,CUTLASS,gemm,cutlass_tensorop_s1688gemm_f16_64x64_32x2_nn_align1,passed,success,universal,1,32,8192,f16:column,f16:column,f32:column,f32:column,1,0,serial,1,1,heuristic,invalid,invalid,False,False,1,tensorop,f32,64,64,32,1,1,1,0,0,0,2,2,2,1,16,8,8,75,1024,540800,524352,0,0.190157,2.64865,2.75747
593,CUTLASS,gemm,cutlass_tensorop_s1688gemm_f16_64x64_32x2_nn_align1,passed,success,universal,1,32,12288,f16:column,f16:column,f32:column,f32:column,1,0,serial,1,1,heuristic,invalid,invalid,False,False,1,tensorop,f32,64,64,32,1,1,1,0,0,0,2,2,2,1,16,8,8,75,1024,811136,786496,0,0.288522,2.61827,2.72595
849,CUTLASS,gemm,cutlass_tensorop_s1688gemm_f16_64x64_32x2_nn_align1,passed,success,universal,1,32,16384,f16:column,f16:column,f32:column,f32:column,1,0,serial,1,1,heuristic,invalid,invalid,False,False,1,tensorop,f32,64,64,32,1,1,1,0,0,0,2,2,2,1,16,8,8,75,1024,1081472,1048640,0,0.376474,2.67535,2.78543
97,CUTLASS,gemm,cutlass_tensorop_s1688gemm_f16_64x64_32x2_nn_align1,passed,success,universal,1,64,16,f16:column,f16:column,f32:column,f32:column,1,0,serial,1,1,heuristic,invalid,invalid,False,False,1,tensorop,f32,64,64,32,1,1,1,0,0,0,2,2,2,1,16,8,8,75,1024,2336,2176,0,0.00513024,0.424068,0.424152
353,CUTLASS,gemm,cutlass_tensorop_s1688gemm_f16_64x64_32x2_nn_align1,passed,success,universal,1,64,32,f16:column,f16:column,f32:column,f32:column,1,0,serial,1,1,heuristic,invalid,invalid,False,False,1,tensorop,f32,64,64,32,1,1,1,0,0,0,2,2,2,1,16,8,8,75,1024,4416,4224,0,0.00462848,0.888568,0.912611
609,CUTLASS,gemm,cutlass_tensorop_s1688gemm_f16_64x64_32x2_nn_align1,passed,success,universal,1,64,64,f16:column,f16:column,f32:column,f32:column,1,0,serial,1,1,heuristic,invalid,invalid,False,False,1,tensorop,f32,64,64,32,1,1,1,0,0,0,2,2,2,1,16,8,8,75,1024,8576,8320,0,0.00594944,1.34248,1.39845
865,CUTLASS,gemm,cutlass_tensorop_s1688gemm_f16_64x64_32x2_nn_align1,passed,success,universal,1,64,128,f16:column,f16:column,f32:column,f32:column,1,0,serial,1,1,heuristic,invalid,invalid,False,False,1,tensorop,f32,64,64,32,1,1,1,0,0,0,2,2,2,1,16,8,8,75,1024,16896,16512,0,0.00782336,2.01136,2.1106
1121,CUTLASS,gemm,cutlass_tensorop_s1688gemm_f16_64x64_32x2_nn_align1,passed,success,universal,1,64,256,f16:column,f16:column,f32:column,f32:column,1,0,serial,1,1,heuristic,invalid,invalid,False,False,1,tensorop,f32,64,64,32,1,1,1,0,0,0,2,2,2,1,16,8,8,75,1024,33536,32896,0,0.0116122,2.68967,2.83289
1377,CUTLASS,gemm,cutlass_tensorop_s1688gemm_f16_64x64_32x2_nn_align1,passed,success,universal,1,64,512,f16:column,f16:column,f32:column,f32:column,1,0,serial,1,1,heuristic,invalid,invalid,False,False,1,tensorop,f32,64,64,32,1,1,1,0,0,0,2,2,2,1,16,8,8,75,1024,66816,65664,0,0.0188928,3.2937,3.47561
1633,CUTLASS,gemm,cutlass_tensorop_s1688gemm_f16_64x64_32x2_nn_align1,passed,success,universal,1,64,1024,f16:column,f16:column,f32:column,f32:column,1,0,serial,1,1,heuristic,invalid,invalid,False,False,1,tensorop,f32,64,64,32,1,1,1,0,0,0,2,2,2,1,16,8,8,75,1024,133376,131200,0,0.0337715,3.67813,3.88493
1889,CUTLASS,gemm,cutlass_tensorop_s1688gemm_f16_64x64_32x2_nn_align1,passed,success,universal,1,64,2048,f16:column,f16:column,f32:column,f32:column,1,0,serial,1,1,heuristic,invalid,invalid,False,False,1,tensorop,f32,64,64,32,1,1,1,0,0,0,2,2,2,1,16,8,8,75,1024,266496,262272,0,0.0634573,3.91119,4.13305
2145,CUTLASS,gemm,cutlass_tensorop_s1688gemm_f16_64x64_32x2_nn_align1,passed,success,universal,1,64,4096,f16:column,f16:column,f32:column,f32:column,1,0,serial,1,1,heuristic,invalid,invalid,False,False,1,tensorop,f32,64,64,32,1,1,1,0,0,0,2,2,2,1,16,8,8,75,1024,532736,524416,0,0.12457,3.98291,4.20982
353,CUTLASS,gemm,cutlass_tensorop_s1688gemm_f16_64x64_32x2_nn_align1,passed,success,universal,1,64,8192,f16:column,f16:column,f32:column,f32:column,1,0,serial,1,1,heuristic,invalid,invalid,False,False,1,tensorop,f32,64,64,32,1,1,1,0,0,0,2,2,2,1,16,8,8,75,1024,1065216,1048704,0,0.242207,4.09592,4.32979
609,CUTLASS,gemm,cutlass_tensorop_s1688gemm_f16_64x64_32x2_nn_align1,passed,success,universal,1,64,12288,f16:column,f16:column,f32:column,f32:column,1,0,serial,1,1,heuristic,invalid,invalid,False,False,1,tensorop,f32,64,64,32,1,1,1,0,0,0,2,2,2,1,16,8,8,75,1024,1597696,1572992,0,0.360243,4.13046,4.36647
865,CUTLASS,gemm,cutlass_tensorop_s1688gemm_f16_64x64_32x2_nn_align1,passed,success,universal,1,64,16384,f16:column,f16:column,f32:column,f32:column,1,0,serial,1,1,heuristic,invalid,invalid,False,False,1,tensorop,f32,64,64,32,1,1,1,0,0,0,2,2,2,1,16,8,8,75,1024,2130176,2097280,0,0.479263,4.13944,4.37605
113,CUTLASS,gemm,cutlass_tensorop_s1688gemm_f16_64x64_32x2_nn_align1,passed,success,universal,1,128,16,f16:column,f16:column,f32:column,f32:column,1,0,serial,1,1,heuristic,invalid,invalid,False,False,1,tensorop,f32,64,64,32,1,1,1,0,0,0,2,2,2,1,16,8,8,75,1024,4640,4352,0,0.00518144,0.834003,0.839921
369,CUTLASS,gemm,cutlass_tensorop_s1688gemm_f16_64x64_32x2_nn_align1,passed,success,universal,1,128,32,f16:column,f16:column,f32:column,f32:column,1,0,serial,1,1,heuristic,invalid,invalid,False,False,1,tensorop,f32,64,64,32,1,1,1,0,0,0,2,2,2,1,16,8,8,75,1024,8768,8448,0,0.00509952,1.6013,1.65663
625,CUTLASS,gemm,cutlass_tensorop_s1688gemm_f16_64x64_32x2_nn_align1,passed,success,universal,1,128,64,f16:column,f16:column,f32:column,f32:column,1,0,serial,1,1,heuristic,invalid,invalid,False,False,1,tensorop,f32,64,64,32,1,1,1,0,0,0,2,2,2,1,16,8,8,75,1024,17024,16640,0,0.00615424,2.57625,2.70383
881,CUTLASS,gemm,cutlass_tensorop_s1688gemm_f16_64x64_32x2_nn_align1,passed,success,universal,1,128,128,f16:column,f16:column,f32:column,f32:column,1,0,serial,1,1,heuristic,invalid,invalid,False,False,1,tensorop,f32,64,64,32,1,1,1,0,0,0,2,2,2,1,16,8,8,75,1024,33536,33024,0,0.00784384,3.98183,4.21018
1137,CUTLASS,gemm,cutlass_tensorop_s1688gemm_f16_64x64_32x2_nn_align1,passed,success,universal,1,128,256,f16:column,f16:column,f32:column,f32:column,1,0,serial,1,1,heuristic,invalid,invalid,False,False,1,tensorop,f32,64,64,32,1,1,1,0,0,0,2,2,2,1,16,8,8,75,1024,66560,65792,0,0.0115917,5.3477,5.6758
1393,CUTLASS,gemm,cutlass_tensorop_s1688gemm_f16_64x64_32x2_nn_align1,passed,success,universal,1,128,512,f16:column,f16:column,f32:column,f32:column,1,0,serial,1,1,heuristic,invalid,invalid,False,False,1,tensorop,f32,64,64,32,1,1,1,0,0,0,2,2,2,1,16,8,8,75,1024,132608,131328,0,0.0191181,6.4599,6.86931
1649,CUTLASS,gemm,cutlass_tensorop_s1688gemm_f16_64x64_32x2_nn_align1,passed,success,universal,1,128,1024,f16:column,f16:column,f32:column,f32:column,1,0,serial,1,1,heuristic,invalid,invalid,False,False,1,tensorop,f32,64,64,32,1,1,1,0,0,0,2,2,2,1,16,8,8,75,1024,264704,262400,0,0.0340582,7.23833,7.70445
1905,CUTLASS,gemm,cutlass_tensorop_s1688gemm_f16_64x64_32x2_nn_align1,passed,success,universal,1,128,2048,f16:column,f16:column,f32:column,f32:column,1,0,serial,1,1,heuristic,invalid,invalid,False,False,1,tensorop,f32,64,64,32,1,1,1,0,0,0,2,2,2,1,16,8,8,75,1024,528896,524544,0,0.0635802,7.74727,8.25012
2161,CUTLASS,gemm,cutlass_tensorop_s1688gemm_f16_64x64_32x2_nn_align1,passed,success,universal,1,128,4096,f16:column,f16:column,f32:column,f32:column,1,0,serial,1,1,heuristic,invalid,invalid,False,False,1,tensorop,f32,64,64,32,1,1,1,0,0,0,2,2,2,1,16,8,8,75,1024,1057280,1048832,0,0.123638,7.96414,8.4831
369,CUTLASS,gemm,cutlass_tensorop_s1688gemm_f16_64x128_64x2_nn_align1,passed,success,universal,1,128,8192,f16:column,f16:column,f32:column,f32:column,1,0,serial,1,1,heuristic,invalid,invalid,False,False,1,tensorop,f32,64,128,64,1,1,1,0,0,0,2,1,2,2,16,8,8,75,1024,2114048,2097408,0,0.239565,8.21849,8.75508
625,CUTLASS,gemm,cutlass_tensorop_s1688gemm_f16_64x128_64x2_nn_align1,passed,success,universal,1,128,12288,f16:column,f16:column,f32:column,f32:column,1,0,serial,1,1,heuristic,invalid,invalid,False,False,1,tensorop,f32,64,128,64,1,1,1,0,0,0,2,1,2,2,16,8,8,75,1024,3170816,3145984,0,0.350505,8.42514,8.97558
881,CUTLASS,gemm,cutlass_tensorop_s1688gemm_f16_64x64_32x2_nn_align1,passed,success,universal,1,128,16384,f16:column,f16:column,f32:column,f32:column,1,0,serial,1,1,heuristic,invalid,invalid,False,False,1,tensorop,f32,64,64,32,1,1,1,0,0,0,2,2,2,1,16,8,8,75,1024,4227584,4194560,0,0.489974,8.03562,8.56079
129,CUTLASS,gemm,cutlass_tensorop_s1688gemm_f16_64x64_32x2_nn_align1,passed,success,universal,1,256,16,f16:column,f16:column,f32:column,f32:column,1,0,serial,1,1,heuristic,invalid,invalid,False,False,1,tensorop,f32,64,64,32,1,1,1,0,0,0,2,2,2,1,16,8,8,75,1024,9248,8704,0,0.00508928,1.69236,1.71026
385,CUTLASS,gemm,cutlass_tensorop_s1688gemm_f16_64x64_32x2_nn_align1,passed,success,universal,1,256,32,f16:column,f16:column,f32:column,f32:column,1,0,serial,1,1,heuristic,invalid,invalid,False,False,1,tensorop,f32,64,64,32,1,1,1,0,0,0,2,2,2,1,16,8,8,75,1024,17472,16896,0,0.00523264,3.10972,3.22896
641,CUTLASS,gemm,cutlass_tensorop_s1688gemm_f16_64x64_32x2_nn_align1,passed,success,universal,1,256,64,f16:column,f16:column,f32:column,f32:column,1,0,serial,1,1,heuristic,invalid,invalid,False,False,1,tensorop,f32,64,64,32,1,1,1,0,0,0,2,2,2,1,16,8,8,75,1024,33920,33280,0,0.00626688,5.04086,5.31046
897,CUTLASS,gemm,cutlass_tensorop_s1688gemm_f16_64x64_32x2_nn_align1,passed,success,universal,1,256,128,f16:column,f16:column,f32:column,f32:column,1,0,serial,1,1,heuristic,invalid,invalid,False,False,1,tensorop,f32,64,64,32,1,1,1,0,0,0,2,2,2,1,16,8,8,75,1024,66816,66048,0,0.007936,7.84113,8.32258
1153,CUTLASS,gemm,cutlass_tensorop_s1688gemm_f16_64x64_32x2_nn_align1,passed,success,universal,1,256,256,f16:column,f16:column,f32:column,f32:column,1,0,serial,1,1,heuristic,invalid,invalid,False,False,1,tensorop,f32,64,64,32,1,1,1,0,0,0,2,2,2,1,16,8,8,75,1024,132608,131584,0,0.0118886,10.3881,11.068
1409,CUTLASS,gemm,cutlass_tensorop_s1688gemm_f16_64x64_32x2_nn_align1,passed,success,universal,1,256,512,f16:column,f16:column,f32:column,f32:column,1,0,serial,1,1,heuristic,invalid,invalid,False,False,1,tensorop,f32,64,64,32,1,1,1,0,0,0,2,2,2,1,16,8,8,75,1024,264192,262656,0,0.0192614,12.7741,13.6364
1665,CUTLASS,gemm,cutlass_tensorop_s1688gemm_f16_64x64_32x2_nn_align1,passed,success,universal,1,256,1024,f16:column,f16:column,f32:column,f32:column,1,0,serial,1,1,heuristic,invalid,invalid,False,False,1,tensorop,f32,64,64,32,1,1,1,0,0,0,2,2,2,1,16,8,8,75,1024,527360,524800,0,0.0343757,14.2875,15.2666
1921,CUTLASS,gemm,cutlass_tensorop_s1688gemm_f16_64x64_32x2_nn_align1,passed,success,universal,1,256,2048,f16:column,f16:column,f32:column,f32:column,1,0,serial,1,1,heuristic,invalid,invalid,False,False,1,tensorop,f32,64,64,32,1,1,1,0,0,0,2,2,2,1,16,8,8,75,1024,1053696,1049088,0,0.0642253,15.2795,16.3345
2177,CUTLASS,gemm,cutlass_tensorop_s1688gemm_f16_64x128_64x2_nn_align1,passed,success,universal,1,256,4096,f16:column,f16:column,f32:column,f32:column,1,0,serial,1,1,heuristic,invalid,invalid,False,False,1,tensorop,f32,64,128,64,1,1,1,0,0,0,2,1,2,2,16,8,8,75,1024,2106368,2097664,0,0.122296,16.0406,17.1523
385,CUTLASS,gemm,cutlass_tensorop_s1688gemm_f16_64x128_64x2_nn_align1,passed,success,universal,1,256,8192,f16:column,f16:column,f32:column,f32:column,1,0,serial,1,1,heuristic,invalid,invalid,False,False,1,tensorop,f32,64,128,64,1,1,1,0,0,0,2,1,2,2,16,8,8,75,1024,4211712,4194816,0,0.230134,17.0443,18.2277
641,CUTLASS,gemm,cutlass_tensorop_s1688gemm_f16_64x128_64x2_nn_align1,passed,success,universal,1,256,12288,f16:column,f16:column,f32:column,f32:column,1,0,serial,1,1,heuristic,invalid,invalid,False,False,1,tensorop,f32,64,128,64,1,1,1,0,0,0,2,1,2,2,16,8,8,75,1024,6317056,6291968,0,0.345508,17.0277,18.2108
897,CUTLASS,gemm,cutlass_tensorop_s1688gemm_f16_64x128_64x2_nn_align1,passed,success,universal,1,256,16384,f16:column,f16:column,f32:column,f32:column,1,0,serial,1,1,heuristic,invalid,invalid,False,False,1,tensorop,f32,64,128,64,1,1,1,0,0,0,2,1,2,2,16,8,8,75,1024,8422400,8389120,0,0.470968,16.655,17.8125
145,CUTLASS,gemm,cutlass_tensorop_s1688gemm_f16_64x64_32x2_nn_align1,passed,success,universal,1,512,16,f16:column,f16:column,f32:column,f32:column,1,0,serial,1,1,heuristic,invalid,invalid,False,False,1,tensorop,f32,64,64,32,1,1,1,0,0,0,2,2,2,1,16,8,8,75,1024,18464,17408,0,0.00526336,3.2671,3.30739
401,CUTLASS,gemm,cutlass_tensorop_s1688gemm_f16_64x64_32x2_nn_align1,passed,success,universal,1,512,32,f16:column,f16:column,f32:column,f32:column,1,0,serial,1,1,heuristic,invalid,invalid,False,False,1,tensorop,f32,64,64,32,1,1,1,0,0,0,2,2,2,1,16,8,8,75,1024,34880,33792,0,0.00523264,6.20806,6.45793
657,CUTLASS,gemm,cutlass_tensorop_s1688gemm_f16_64x64_32x2_nn_align1,passed,success,universal,1,512,64,f16:column,f16:column,f32:column,f32:column,1,0,serial,1,1,heuristic,invalid,invalid,False,False,1,tensorop,f32,64,64,32,1,1,1,0,0,0,2,2,2,1,16,8,8,75,1024,67712,66560,0,0.00621568,10.1456,10.7084
913,CUTLASS,gemm,cutlass_tensorop_s1688gemm_f16_64x64_32x2_nn_align1,passed,success,universal,1,512,128,f16:column,f16:column,f32:column,f32:column,1,0,serial,1,1,heuristic,invalid,invalid,False,False,1,tensorop,f32,64,64,32,1,1,1,0,0,0,2,2,2,1,16,8,8,75,1024,133376,132096,0,0.00802816,15.4725,16.4541
1169,CUTLASS,gemm,cutlass_tensorop_s1688gemm_f16_64x64_32x2_nn_align1,passed,success,universal,1,512,256,f16:column,f16:column,f32:column,f32:column,1,0,serial,1,1,heuristic,invalid,invalid,False,False,1,tensorop,f32,64,64,32,1,1,1,0,0,0,2,2,2,1,16,8,8,75,1024,264704,263168,0,0.0120934,20.385,21.7612
1425,CUTLASS,gemm,cutlass_tensorop_s1688gemm_f16_64x64_32x2_nn_align1,passed,success,universal,1,512,512,f16:column,f16:column,f32:column,f32:column,1,0,serial,1,1,heuristic,invalid,invalid,False,False,1,tensorop,f32,64,64,32,1,1,1,0,0,0,2,2,2,1,16,8,8,75,1024,527360,525312,0,0.019497,25.1907,26.9433
1681,CUTLASS,gemm,cutlass_tensorop_s1688gemm_f16_64x128_64x2_nn_align1,passed,success,universal,1,512,1024,f16:column,f16:column,f32:column,f32:column,1,0,serial,1,1,heuristic,invalid,invalid,False,False,1,tensorop,f32,64,128,64,1,1,1,0,0,0,2,1,2,2,16,8,8,75,1024,1052672,1049600,0,0.0347955,28.1754,30.1648
1937,CUTLASS,gemm,cutlass_tensorop_s1688gemm_f16_64x128_64x2_nn_align1,passed,success,universal,1,512,2048,f16:column,f16:column,f32:column,f32:column,1,0,serial,1,1,heuristic,invalid,invalid,False,False,1,tensorop,f32,64,128,64,1,1,1,0,0,0,2,1,2,2,16,8,8,75,1024,2103296,2098176,0,0.0631296,31.029,33.236
145,CUTLASS,gemm,cutlass_tensorop_s1688gemm_f16_64x128_64x2_nn_align1,passed,success,universal,1,512,4096,f16:column,f16:column,f32:column,f32:column,1,0,serial,1,1,heuristic,invalid,invalid,False,False,1,tensorop,f32,64,128,64,1,1,1,0,0,0,2,1,2,2,16,8,8,75,1024,4204544,4195328,0,0.119316,32.8185,35.1613
401,CUTLASS,gemm,cutlass_tensorop_s1688gemm_f16_64x128_64x2_nn_align1,passed,success,universal,1,512,8192,f16:column,f16:column,f32:column,f32:column,1,0,serial,1,1,heuristic,invalid,invalid,False,False,1,tensorop,f32,64,128,64,1,1,1,0,0,0,2,1,2,2,16,8,8,75,1024,8407040,8389632,0,0.229591,34.1027,36.5416
657,CUTLASS,gemm,cutlass_tensorop_s1688gemm_f16_64x128_64x2_nn_align1,passed,success,universal,1,512,12288,f16:column,f16:column,f32:column,f32:column,1,0,serial,1,1,heuristic,invalid,invalid,False,False,1,tensorop,f32,64,128,64,1,1,1,0,0,0,2,1,2,2,16,8,8,75,1024,12609536,12583936,0,0.342641,34.2736,36.7263
913,CUTLASS,gemm,cutlass_tensorop_s1688gemm_f16_64x128_64x2_nn_align1,passed,success,universal,1,512,16384,f16:column,f16:column,f32:column,f32:column,1,0,serial,1,1,heuristic,invalid,invalid,False,False,1,tensorop,f32,64,128,64,1,1,1,0,0,0,2,1,2,2,16,8,8,75,1024,16812032,16778240,0,0.454687,34.4356,36.9007
161,CUTLASS,gemm,cutlass_tensorop_s1688gemm_f16_64x64_32x2_nn_align1,passed,success,universal,1,1024,16,f16:column,f16:column,f32:column,f32:column,1,0,serial,1,1,heuristic,invalid,invalid,False,False,1,tensorop,f32,64,64,32,1,1,1,0,0,0,2,2,2,1,16,8,8,75,1024,36896,34816,0,0.00531456,6.46565,6.55106
417,CUTLASS,gemm,cutlass_tensorop_s1688gemm_f16_64x64_32x2_nn_align1,passed,success,universal,1,1024,32,f16:column,f16:column,f32:column,f32:column,1,0,serial,1,1,heuristic,invalid,invalid,False,False,1,tensorop,f32,64,64,32,1,1,1,0,0,0,2,2,2,1,16,8,8,75,1024,69696,67584,0,0.00540672,12.0053,12.5
673,CUTLASS,gemm,cutlass_tensorop_s1688gemm_f16_64x64_32x2_nn_align1,passed,success,universal,1,1024,64,f16:column,f16:column,f32:column,f32:column,1,0,serial,1,1,heuristic,invalid,invalid,False,False,1,tensorop,f32,64,64,32,1,1,1,0,0,0,2,2,2,1,16,8,8,75,1024,135296,133120,0,0.00616448,20.4404,21.5947
929,CUTLASS,gemm,cutlass_tensorop_s1688gemm_f16_64x64_32x2_nn_align1,passed,success,universal,1,1024,128,f16:column,f16:column,f32:column,f32:column,1,0,serial,1,1,heuristic,invalid,invalid,False,False,1,tensorop,f32,64,64,32,1,1,1,0,0,0,2,2,2,1,16,8,8,75,1024,266496,264192,0,0.00820224,30.2593,32.2097
1185,CUTLASS,gemm,cutlass_tensorop_s1688gemm_f16_64x64_32x2_nn_align1,passed,success,universal,1,1024,256,f16:column,f16:column,f32:column,f32:column,1,0,serial,1,1,heuristic,invalid,invalid,False,False,1,tensorop,f32,64,64,32,1,1,1,0,0,0,2,2,2,1,16,8,8,75,1024,528896,526336,0,0.0122061,40.3547,43.1208
1441,CUTLASS,gemm,cutlass_tensorop_s1688gemm_f16_64x64_32x2_nn_align1,passed,success,universal,1,1024,512,f16:column,f16:column,f32:column,f32:column,1,0,serial,1,1,heuristic,invalid,invalid,False,False,1,tensorop,f32,64,64,32,1,1,1,0,0,0,2,2,2,1,16,8,8,75,1024,1053696,1050624,0,0.0199168,49.2715,52.7506
1697,CUTLASS,gemm,cutlass_tensorop_s1688gemm_f16_64x128_64x2_nn_align1,passed,success,universal,1,1024,1024,f16:column,f16:column,f32:column,f32:column,1,0,serial,1,1,heuristic,invalid,invalid,False,False,1,tensorop,f32,64,128,64,1,1,1,0,0,0,2,1,2,2,16,8,8,75,1024,2103296,2099200,0,0.0354202,55.3032,59.2657
1953,CUTLASS,gemm,cutlass_tensorop_s1688gemm_f16_64x128_64x2_nn_align1,passed,success,universal,1,1024,2048,f16:column,f16:column,f32:column,f32:column,1,0,serial,1,1,heuristic,invalid,invalid,False,False,1,tensorop,f32,64,128,64,1,1,1,0,0,0,2,1,2,2,16,8,8,75,1024,4202496,4196352,0,0.0628838,62.2398,66.7318
2209,CUTLASS,gemm,cutlass_tensorop_s1688gemm_f16_64x128_64x2_nn_align1,passed,success,universal,1,1024,4096,f16:column,f16:column,f32:column,f32:column,1,0,serial,1,1,heuristic,invalid,invalid,False,False,1,tensorop,f32,64,128,64,1,1,1,0,0,0,2,1,2,2,16,8,8,75,1024,8400896,8390656,0,0.11988,65.265,69.9923
417,CUTLASS,gemm,cutlass_tensorop_s1688gemm_f16_64x128_64x2_nn_align1,passed,success,universal,1,1024,8192,f16:column,f16:column,f32:column,f32:column,1,0,serial,1,1,heuristic,invalid,invalid,False,False,1,tensorop,f32,64,128,64,1,1,1,0,0,0,2,1,2,2,16,8,8,75,1024,16797696,16779264,0,0.230472,67.8785,72.804
673,CUTLASS,gemm,cutlass_tensorop_s1688gemm_f16_64x128_64x2_nn_align1,passed,success,universal,1,1024,12288,f16:column,f16:column,f32:column,f32:column,1,0,serial,1,1,heuristic,invalid,invalid,False,False,1,tensorop,f32,64,128,64,1,1,1,0,0,0,2,1,2,2,16,8,8,75,1024,25194496,25167872,0,0.346348,67.7476,72.6665
929,CUTLASS,gemm,cutlass_tensorop_s1688gemm_f16_64x128_64x2_nn_align1,passed,success,universal,1,1024,16384,f16:column,f16:column,f32:column,f32:column,1,0,serial,1,1,heuristic,invalid,invalid,False,False,1,tensorop,f32,64,128,64,1,1,1,0,0,0,2,1,2,2,16,8,8,75,1024,33591296,33556480,0,0.451154,69.3429,74.3792
177,CUTLASS,gemm,cutlass_tensorop_s1688gemm_f16_64x64_32x2_nn_align1,passed,success,universal,1,2048,16,f16:column,f16:column,f32:column,f32:column,1,0,serial,1,1,heuristic,invalid,invalid,False,False,1,tensorop,f32,64,64,32,1,1,1,0,0,0,2,2,2,1,16,8,8,75,1024,73760,69632,0,0.0053248,12.9008,13.0769
433,CUTLASS,gemm,cutlass_tensorop_s1688gemm_f16_64x64_32x2_nn_align1,passed,success,universal,1,2048,32,f16:column,f16:column,f32:column,f32:column,1,0,serial,1,1,heuristic,invalid,invalid,False,False,1,tensorop,f32,64,64,32,1,1,1,0,0,0,2,2,2,1,16,8,8,75,1024,139328,135168,0,0.0054272,23.9091,24.9057
689,CUTLASS,gemm,cutlass_tensorop_s1688gemm_f16_64x64_32x2_nn_align1,passed,success,universal,1,2048,64,f16:column,f16:column,f32:column,f32:column,1,0,serial,1,1,heuristic,invalid,invalid,False,False,1,tensorop,f32,64,64,32,1,1,1,0,0,0,2,2,2,1,16,8,8,75,1024,270464,266240,0,0.00651264,38.677,40.8805
945,CUTLASS,gemm,cutlass_tensorop_s1688gemm_f16_64x64_32x2_nn_align1,passed,success,universal,1,2048,128,f16:column,f16:column,f32:column,f32:column,1,0,serial,1,1,heuristic,invalid,invalid,False,False,1,tensorop,f32,64,64,32,1,1,1,0,0,0,2,2,2,1,16,8,8,75,1024,532736,528384,0,0.00825344,60.1142,64.0198
1201,CUTLASS,gemm,cutlass_tensorop_s1688gemm_f16_64x64_32x2_nn_align1,passed,success,universal,1,2048,256,f16:column,f16:column,f32:column,f32:column,1,0,serial,1,1,heuristic,invalid,invalid,False,False,1,tensorop,f32,64,64,32,1,1,1,0,0,0,2,2,2,1,16,8,8,75,1024,1057280,1052672,0,0.0121139,81.2841,86.8977
1457,CUTLASS,gemm,cutlass_tensorop_s1688gemm_f16_64x64_32x2_nn_align1,passed,success,universal,1,2048,512,f16:column,f16:column,f32:column,f32:column,1,0,serial,1,1,heuristic,invalid,invalid,False,False,1,tensorop,f32,64,64,32,1,1,1,0,0,0,2,2,2,1,16,8,8,75,1024,2106368,2101248,0,0.0200602,97.7912,104.747
1713,CUTLASS,gemm,cutlass_tensorop_s1688gemm_f16_64x128_64x2_nn_align1,passed,success,universal,1,2048,1024,f16:column,f16:column,f32:column,f32:column,1,0,serial,1,1,heuristic,invalid,invalid,False,False,1,tensorop,f32,64,128,64,1,1,1,0,0,0,2,1,2,2,16,8,8,75,1024,4204544,4198400,0,0.0358912,109.102,116.976
1969,CUTLASS,gemm,cutlass_tensorop_s1688gemm_f16_64x128_64x2_nn_align1,passed,success,universal,1,2048,2048,f16:column,f16:column,f32:column,f32:column,1,0,serial,1,1,heuristic,invalid,invalid,False,False,1,tensorop,f32,64,128,64,1,1,1,0,0,0,2,1,2,2,16,8,8,75,1024,8400896,8392704,0,0.0636621,122.898,131.832
2225,CUTLASS,gemm,cutlass_tensorop_s1688gemm_f16_64x128_64x2_nn_align1,passed,success,universal,1,2048,4096,f16:column,f16:column,f32:column,f32:column,1,0,serial,1,1,heuristic,invalid,invalid,False,False,1,tensorop,f32,64,128,64,1,1,1,0,0,0,2,1,2,2,16,8,8,75,1024,16793600,16781312,0,0.122481,127.696,137.012
433,CUTLASS,gemm,cutlass_tensorop_s1688gemm_f16_64x128_64x2_nn_align1,passed,success,universal,1,2048,8192,f16:column,f16:column,f32:column,f32:column,1,0,serial,1,1,heuristic,invalid,invalid,False,False,1,tensorop,f32,64,128,64,1,1,1,0,0,0,2,1,2,2,16,8,8,75,1024,33579008,33558528,0,0.232929,134.259,144.072
689,CUTLASS,gemm,cutlass_tensorop_s1688gemm_f16_64x128_64x2_nn_align1,passed,success,universal,1,2048,12288,f16:column,f16:column,f32:column,f32:column,1,0,serial,1,1,heuristic,invalid,invalid,False,False,1,tensorop,f32,64,128,64,1,1,1,0,0,0,2,1,2,2,16,8,8,75,1024,50364416,50335744,0,0.350689,133.752,143.534
945,CUTLASS,gemm,cutlass_tensorop_s1688gemm_f16_64x128_64x2_nn_align1,passed,success,universal,1,2048,16384,f16:column,f16:column,f32:column,f32:column,1,0,serial,1,1,heuristic,invalid,invalid,False,False,1,tensorop,f32,64,128,64,1,1,1,0,0,0,2,1,2,2,16,8,8,75,1024,67149824,67112960,0,0.457482,136.701,146.701
193,CUTLASS,gemm,cutlass_tensorop_s1688gemm_f16_64x64_32x2_nn_align1,passed,success,universal,1,4096,16,f16:column,f16:column,f32:column,f32:column,1,0,serial,1,1,heuristic,invalid,invalid,False,False,1,tensorop,f32,64,64,32,1,1,1,0,0,0,2,2,2,1,16,8,8,75,1024,147488,139264,0,0.00548864,25.026,25.3731
449,CUTLASS,gemm,cutlass_tensorop_s1688gemm_f16_64x64_32x2_nn_align1,passed,success,universal,1,4096,32,f16:column,f16:column,f32:column,f32:column,1,0,serial,1,1,heuristic,invalid,invalid,False,False,1,tensorop,f32,64,64,32,1,1,1,0,0,0,2,2,2,1,16,8,8,75,1024,278592,270336,0,0.00550912,47.0963,49.0706
705,CUTLASS,gemm,cutlass_tensorop_s1688gemm_f16_64x64_32x2_nn_align1,passed,success,universal,1,4096,64,f16:column,f16:column,f32:column,f32:column,1,0,serial,1,1,heuristic,invalid,invalid,False,False,1,tensorop,f32,64,64,32,1,1,1,0,0,0,2,2,2,1,16,8,8,75,1024,540800,532480,0,0.00647168,77.8251,82.2785
961,CUTLASS,gemm,cutlass_tensorop_s1688gemm_f16_64x64_32x2_nn_align1,passed,success,universal,1,4096,128,f16:column,f16:column,f32:column,f32:column,1,0,serial,1,1,heuristic,invalid,invalid,False,False,1,tensorop,f32,64,64,32,1,1,1,0,0,0,2,2,2,1,16,8,8,75,1024,1065216,1056768,0,0.00850944,116.583,124.188
1217,CUTLASS,gemm,cutlass_tensorop_s1688gemm_f16_64x64_32x2_nn_align1,passed,success,universal,1,4096,256,f16:column,f16:column,f32:column,f32:column,1,0,serial,1,1,heuristic,invalid,invalid,False,False,1,tensorop,f32,64,64,32,1,1,1,0,0,0,2,2,2,1,16,8,8,75,1024,2114048,2105344,0,0.012329,159.694,170.764
1473,CUTLASS,gemm,cutlass_tensorop_s1688gemm_f16_64x64_32x2_nn_align1,passed,success,universal,1,4096,512,f16:column,f16:column,f32:column,f32:column,1,0,serial,1,1,heuristic,invalid,invalid,False,False,1,tensorop,f32,64,64,32,1,1,1,0,0,0,2,2,2,1,16,8,8,75,1024,4211712,4202496,0,0.020183,194.344,208.219
1729,CUTLASS,gemm,cutlass_tensorop_s1688gemm_f16_64x64_32x2_nn_align1,passed,success,universal,1,4096,1024,f16:column,f16:column,f32:column,f32:column,1,0,serial,1,1,heuristic,invalid,invalid,False,False,1,tensorop,f32,64,64,32,1,1,1,0,0,0,2,2,2,1,16,8,8,75,1024,8407040,8396800,0,0.0358093,218.649,234.487
1985,CUTLASS,gemm,cutlass_tensorop_s1688gemm_f16_64x128_64x2_nn_align1,passed,success,universal,1,4096,2048,f16:column,f16:column,f32:column,f32:column,1,0,serial,1,1,heuristic,invalid,invalid,False,False,1,tensorop,f32,64,128,64,1,1,1,0,0,0,2,1,2,2,16,8,8,75,1024,16797696,16785408,0,0.0646349,242.038,259.696
193,CUTLASS,gemm,cutlass_tensorop_s1688gemm_f16_64x128_64x2_nn_align1,passed,success,universal,1,4096,4096,f16:column,f16:column,f32:column,f32:column,1,0,serial,1,1,heuristic,invalid,invalid,False,False,1,tensorop,f32,64,128,64,1,1,1,0,0,0,2,1,2,2,16,8,8,75,1024,33579008,33562624,0,0.124518,251.151,269.539
449,CUTLASS,gemm,cutlass_tensorop_s1688gemm_f16_64x128_64x2_nn_align1,passed,success,universal,1,4096,8192,f16:column,f16:column,f32:column,f32:column,1,0,serial,1,1,heuristic,invalid,invalid,False,False,1,tensorop,f32,64,128,64,1,1,1,0,0,0,2,1,2,2,16,8,8,75,1024,67141632,67117056,0,0.234025,267.196,286.794
705,CUTLASS,gemm,cutlass_tensorop_s1688gemm_f16_64x128_64x2_nn_align1,passed,success,universal,1,4096,12288,f16:column,f16:column,f32:column,f32:column,1,0,serial,1,1,heuristic,invalid,invalid,False,False,1,tensorop,f32,64,128,64,1,1,1,0,0,0,2,1,2,2,16,8,8,75,1024,100704256,100671488,0,0.352,266.444,285.999
961,CUTLASS,gemm,cutlass_tensorop_s1688gemm_f16_64x128_64x2_nn_align1,passed,success,universal,1,4096,16384,f16:column,f16:column,f32:column,f32:column,1,0,serial,1,1,heuristic,invalid,invalid,False,False,1,tensorop,f32,64,128,64,1,1,1,0,0,0,2,1,2,2,16,8,8,75,1024,134266880,134225920,0,0.46295,270.106,289.936
209,CUTLASS,gemm,cutlass_tensorop_s1688gemm_f16_64x64_32x2_nn_align1,passed,success,universal,1,8192,16,f16:column,f16:column,f32:column,f32:column,1,0,serial,1,1,heuristic,invalid,invalid,False,False,1,tensorop,f32,64,64,32,1,1,1,0,0,0,2,2,2,1,16,8,8,75,1024,294944,278528,0,0.00617472,44.4859,45.1078
465,CUTLASS,gemm,cutlass_tensorop_s1688gemm_f16_64x64_32x2_nn_align1,passed,success,universal,1,8192,32,f16:column,f16:column,f32:column,f32:column,1,0,serial,1,1,heuristic,invalid,invalid,False,False,1,tensorop,f32,64,64,32,1,1,1,0,0,0,2,2,2,1,16,8,8,75,1024,557120,540672,0,0.00651264,79.6694,83.0189
721,CUTLASS,gemm,cutlass_tensorop_s1688gemm_f16_64x64_32x2_nn_align1,passed,success,universal,1,8192,64,f16:column,f16:column,f32:column,f32:column,1,0,serial,1,1,heuristic,invalid,invalid,False,False,1,tensorop,f32,64,64,32,1,1,1,0,0,0,2,2,2,1,16,8,8,75,1024,1081472,1064960,0,0.00809984,124.348,131.479
977,CUTLASS,gemm,cutlass_tensorop_s1688gemm_f16_64x64_32x2_nn_align1,passed,success,universal,1,8192,128,f16:column,f16:column,f32:column,f32:column,1,0,serial,1,1,heuristic,invalid,invalid,False,False,1,tensorop,f32,64,64,32,1,1,1,0,0,0,2,2,2,1,16,8,8,75,1024,2130176,2113536,0,0.010455,189.754,202.155
1233,CUTLASS,gemm,cutlass_tensorop_s1688gemm_f16_64x64_32x2_nn_align1,passed,success,universal,1,8192,256,f16:column,f16:column,f32:column,f32:column,1,0,serial,1,1,heuristic,invalid,invalid,False,False,1,tensorop,f32,64,64,32,1,1,1,0,0,0,2,2,2,1,16,8,8,75,1024,4227584,4210688,0,0.0154317,255.14,272.86
1489,CUTLASS,gemm,cutlass_tensorop_s1688gemm_f16_64x64_32x2_nn_align1,passed,success,universal,1,8192,512,f16:column,f16:column,f32:column,f32:column,1,0,serial,1,1,heuristic,invalid,invalid,False,False,1,tensorop,f32,64,64,32,1,1,1,0,0,0,2,2,2,1,16,8,8,75,1024,8422400,8404992,0,0.0254362,308.379,330.435
1745,CUTLASS,gemm,cutlass_tensorop_s1688gemm_f16_64x64_32x2_nn_align1,passed,success,universal,1,8192,1024,f16:column,f16:column,f32:column,f32:column,1,0,serial,1,1,heuristic,invalid,invalid,False,False,1,tensorop,f32,64,64,32,1,1,1,0,0,0,2,2,2,1,16,8,8,75,1024,16812032,16793600,0,0.0452096,346.33,371.461
2001,CUTLASS,gemm,cutlass_tensorop_s1688gemm_f16_64x64_32x2_nn_align1,passed,success,universal,1,8192,2048,f16:column,f16:column,f32:column,f32:column,1,0,serial,1,1,heuristic,invalid,invalid,False,False,1,tensorop,f32,64,64,32,1,1,1,0,0,0,2,2,2,1,16,8,8,75,1024,33591296,33570816,0,0.0854835,365.969,392.717
2257,CUTLASS,gemm,cutlass_tensorop_s1688gemm_f16_64x64_32x2_nn_align1,passed,success,universal,1,8192,4096,f16:column,f16:column,f32:column,f32:column,1,0,serial,1,1,heuristic,invalid,invalid,False,False,1,tensorop,f32,64,64,32,1,1,1,0,0,0,2,2,2,1,16,8,8,75,1024,67149824,67125248,0,0.164628,379.874,407.738
465,CUTLASS,gemm,cutlass_tensorop_s1688gemm_f16_64x64_32x2_nn_align1,passed,success,universal,1,8192,8192,f16:column,f16:column,f32:column,f32:column,1,0,serial,1,1,heuristic,invalid,invalid,False,False,1,tensorop,f32,64,64,32,1,1,1,0,0,0,2,2,2,1,16,8,8,75,1024,134266880,134234112,0,0.320563,390.082,418.745
721,CUTLASS,gemm,cutlass_tensorop_s1688gemm_f16_64x128_64x2_nn_align1,passed,success,universal,1,8192,12288,f16:column,f16:column,f32:column,f32:column,1,0,serial,1,1,heuristic,invalid,invalid,False,False,1,tensorop,f32,64,128,64,1,1,1,0,0,0,2,1,2,2,16,8,8,75,1024,201383936,201342976,0,0.48895,383.584,411.787
977,CUTLASS,gemm,cutlass_tensorop_s1688gemm_f16_64x64_32x2_nn_align1,passed,success,universal,1,8192,16384,f16:column,f16:column,f32:column,f32:column,1,0,serial,1,1,heuristic,invalid,invalid,False,False,1,tensorop,f32,64,64,32,1,1,1,0,0,0,2,2,2,1,16,8,8,75,1024,268500992,268451840,0,0.636027,393.161,422.076
225,CUTLASS,gemm,cutlass_tensorop_s1688gemm_f16_64x64_32x2_nn_align1,passed,success,universal,1,12288,16,f16:column,f16:column,f32:column,f32:column,1,0,serial,1,1,heuristic,invalid,invalid,False,False,1,tensorop,f32,64,64,32,1,1,1,0,0,0,2,2,2,1,16,8,8,75,1024,442400,417792,0,0.0064,64.3777,65.28
481,CUTLASS,gemm,cutlass_tensorop_s1688gemm_f16_64x64_32x2_nn_align1,passed,success,universal,1,12288,32,f16:column,f16:column,f32:column,f32:column,1,0,serial,1,1,heuristic,invalid,invalid,False,False,1,tensorop,f32,64,64,32,1,1,1,0,0,0,2,2,2,1,16,8,8,75,1024,835648,811008,0,0.00668672,116.389,121.286
737,CUTLASS,gemm,cutlass_tensorop_s1688gemm_f16_64x64_32x2_nn_align1,passed,success,universal,1,12288,64,f16:column,f16:column,f32:column,f32:column,1,0,serial,1,1,heuristic,invalid,invalid,False,False,1,tensorop,f32,64,64,32,1,1,1,0,0,0,2,2,2,1,16,8,8,75,1024,1622144,1597440,0,0.00840704,179.699,190.012
993,CUTLASS,gemm,cutlass_tensorop_s1688gemm_f16_64x64_32x2_nn_align1,passed,success,universal,1,12288,128,f16:column,f16:column,f32:column,f32:column,1,0,serial,1,1,heuristic,invalid,invalid,False,False,1,tensorop,f32,64,64,32,1,1,1,0,0,0,2,2,2,1,16,8,8,75,1024,3195136,3170304,0,0.0108851,273.373,291.251
1249,CUTLASS,gemm,cutlass_tensorop_s1688gemm_f16_64x64_32x2_nn_align1,passed,success,universal,1,12288,256,f16:column,f16:column,f32:column,f32:column,1,0,serial,1,1,heuristic,invalid,invalid,False,False,1,tensorop,f32,64,64,32,1,1,1,0,0,0,2,2,2,1,16,8,8,75,1024,6341120,6316032,0,0.0162099,364.322,389.64
1505,CUTLASS,gemm,cutlass_tensorop_s1688gemm_f16_64x64_32x2_nn_align1,passed,success,universal,1,12288,512,f16:column,f16:column,f32:column,f32:column,1,0,serial,1,1,heuristic,invalid,invalid,False,False,1,tensorop,f32,64,64,32,1,1,1,0,0,0,2,2,2,1,16,8,8,75,1024,12633088,12607488,0,0.0266035,442.253,473.903
1761,CUTLASS,gemm,cutlass_tensorop_s1688gemm_f16_64x64_32x2_nn_align1,passed,success,universal,1,12288,1024,f16:column,f16:column,f32:column,f32:column,1,0,serial,1,1,heuristic,invalid,invalid,False,False,1,tensorop,f32,64,64,32,1,1,1,0,0,0,2,2,2,1,16,8,8,75,1024,25217024,25190400,0,0.047657,492.797,528.578
2017,CUTLASS,gemm,cutlass_tensorop_s1688gemm_f16_64x64_32x2_nn_align1,passed,success,universal,1,12288,2048,f16:column,f16:column,f32:column,f32:column,1,0,serial,1,1,heuristic,invalid,invalid,False,False,1,tensorop,f32,64,64,32,1,1,1,0,0,0,2,2,2,1,16,8,8,75,1024,50384896,50356224,0,0.0881152,532.537,571.482
2273,CUTLASS,gemm,cutlass_tensorop_s1688gemm_f16_64x64_32x2_nn_align1,passed,success,universal,1,12288,4096,f16:column,f16:column,f32:column,f32:column,1,0,serial,1,1,heuristic,invalid,invalid,False,False,1,tensorop,f32,64,64,32,1,1,1,0,0,0,2,2,2,1,16,8,8,75,1024,100720640,100687872,0,0.16855,556.53,597.375
481,CUTLASS,gemm,cutlass_tensorop_s1688gemm_f16_64x64_32x2_nn_align1,passed,success,universal,1,12288,8192,f16:column,f16:column,f32:column,f32:column,1,0,serial,1,1,heuristic,invalid,invalid,False,False,1,tensorop,f32,64,64,32,1,1,1,0,0,0,2,2,2,1,16,8,8,75,1024,201392128,201351168,0,0.326431,574.581,616.827
737,CUTLASS,gemm,cutlass_tensorop_s1688gemm_f16_64x128_64x2_nn_align1,passed,success,universal,1,12288,12288,f16:column,f16:column,f32:column,f32:column,1,0,serial,1,1,heuristic,invalid,invalid,False,False,1,tensorop,f32,64,128,64,1,1,1,0,0,0,2,1,2,2,16,8,8,75,1024,302063616,302014464,0,0.495636,567.591,609.347
993,CUTLASS,gemm,cutlass_tensorop_s1688gemm_f16_64x64_32x2_nn_align1,passed,success,universal,1,12288,16384,f16:column,f16:column,f32:column,f32:column,1,0,serial,1,1,heuristic,invalid,invalid,False,False,1,tensorop,f32,64,64,32,1,1,1,0,0,0,2,2,2,1,16,8,8,75,1024,402735104,402677760,0,0.646185,580.447,623.162
241,CUTLASS,gemm,cutlass_tensorop_s1688gemm_f16_64x64_32x2_nn_align1,passed,success,universal,1,16384,16,f16:column,f16:column,f32:column,f32:column,1,0,serial,1,1,heuristic,invalid,invalid,False,False,1,tensorop,f32,64,64,32,1,1,1,0,0,0,2,2,2,1,16,8,8,75,1024,589856,557056,0,0.00710656,77.3013,78.3862
497,CUTLASS,gemm,cutlass_tensorop_s1688gemm_f16_64x64_32x2_nn_align1,passed,success,universal,1,16384,32,f16:column,f16:column,f32:column,f32:column,1,0,serial,1,1,heuristic,invalid,invalid,False,False,1,tensorop,f32,64,64,32,1,1,1,0,0,0,2,2,2,1,16,8,8,75,1024,1114176,1081344,0,0.0074752,138.813,144.658
753,CUTLASS,gemm,cutlass_tensorop_s1688gemm_f16_64x64_32x2_nn_align1,passed,success,universal,1,16384,64,f16:column,f16:column,f32:column,f32:column,1,0,serial,1,1,heuristic,invalid,invalid,False,False,1,tensorop,f32,64,64,32,1,1,1,0,0,0,2,2,2,1,16,8,8,75,1024,2162816,2129920,0,0.0100762,199.905,211.382
1009,CUTLASS,gemm,cutlass_tensorop_s1688gemm_f16_64x64_32x2_nn_align1,passed,success,universal,1,16384,128,f16:column,f16:column,f32:column,f32:column,1,0,serial,1,1,heuristic,invalid,invalid,False,False,1,tensorop,f32,64,64,32,1,1,1,0,0,0,2,2,2,1,16,8,8,75,1024,4260096,4227072,0,0.0133632,296.899,316.322
1265,CUTLASS,gemm,cutlass_tensorop_s1688gemm_f16_64x64_32x2_nn_align1,passed,success,universal,1,16384,256,f16:column,f16:column,f32:column,f32:column,1,0,serial,1,1,heuristic,invalid,invalid,False,False,1,tensorop,f32,64,64,32,1,1,1,0,0,0,2,2,2,1,16,8,8,75,1024,8454656,8421376,0,0.0201728,390.328,417.462
1521,CUTLASS,gemm,cutlass_tensorop_s1688gemm_f16_64x64_32x2_nn_align1,passed,success,universal,1,16384,512,f16:column,f16:column,f32:column,f32:column,1,0,serial,1,1,heuristic,invalid,invalid,False,False,1,tensorop,f32,64,64,32,1,1,1,0,0,0,2,2,2,1,16,8,8,75,1024,16843776,16809984,0,0.0340992,460.04,492.973
1777,CUTLASS,gemm,cutlass_tensorop_s1688gemm_f16_64x64_32x2_nn_align1,passed,success,universal,1,16384,1024,f16:column,f16:column,f32:column,f32:column,1,0,serial,1,1,heuristic,invalid,invalid,False,False,1,tensorop,f32,64,64,32,1,1,1,0,0,0,2,2,2,1,16,8,8,75,1024,33622016,33587200,0,0.061993,505.105,541.791
2033,CUTLASS,gemm,cutlass_tensorop_s1688gemm_f16_64x64_32x2_nn_align1,passed,success,universal,1,16384,2048,f16:column,f16:column,f32:column,f32:column,1,0,serial,1,1,heuristic,invalid,invalid,False,False,1,tensorop,f32,64,64,32,1,1,1,0,0,0,2,2,2,1,16,8,8,75,1024,67178496,67141632,0,0.116367,537.649,576.98
241,CUTLASS,gemm,cutlass_tensorop_s1688gemm_f16_64x64_32x2_nn_align1,passed,success,universal,1,16384,4096,f16:column,f16:column,f32:column,f32:column,1,0,serial,1,1,heuristic,invalid,invalid,False,False,1,tensorop,f32,64,64,32,1,1,1,0,0,0,2,2,2,1,16,8,8,75,1024,134291456,134250496,0,0.223877,558.649,599.662
497,CUTLASS,gemm,cutlass_tensorop_s1688gemm_f16_64x64_32x2_nn_align1,passed,success,universal,1,16384,8192,f16:column,f16:column,f32:column,f32:column,1,0,serial,1,1,heuristic,invalid,invalid,False,False,1,tensorop,f32,64,64,32,1,1,1,0,0,0,2,2,2,1,16,8,8,75,1024,268517376,268468224,0,0.437862,571.13,613.134
753,CUTLASS,gemm,cutlass_tensorop_s1688gemm_f16_64x64_32x2_nn_align1,passed,success,universal,1,16384,12288,f16:column,f16:column,f32:column,f32:column,1,0,serial,1,1,heuristic,invalid,invalid,False,False,1,tensorop,f32,64,64,32,1,1,1,0,0,0,2,2,2,1,16,8,8,75,1024,402743296,402685952,0,0.687841,545.306,585.434
1009,CUTLASS,gemm,cutlass_tensorop_s1688gemm_f16_64x64_32x2_nn_align1,passed,success,universal,1,16384,16384,f16:column,f16:column,f32:column,f32:column,1,0,serial,1,1,heuristic,invalid,invalid,False,False,1,tensorop,f32,64,64,32,1,1,1,0,0,0,2,2,2,1,16,8,8,75,1024,536969216,536903680,0,0.868874,575.563,617.93
2,CUTLASS,gemm,cutlass_tensorop_s1688gemm_f16_64x64_32x2_nn_align2,passed,success,universal,2,1,16,f16:column,f16:column,f32:column,f32:column,1,0,serial,1,1,heuristic,invalid,invalid,False,False,1,tensorop,f32,64,64,32,1,1,1,0,0,0,2,2,2,1,16,8,8,75,1024,104,68,0,0.00442368,0.0218952,0.0153718
258,CUTLASS,gemm,cutlass_tensorop_s1688gemm_f16_64x64_32x2_nn_align2,passed,success,universal,2,1,32,f16:column,f16:column,f32:column,f32:column,1,0,serial,1,1,heuristic,invalid,invalid,False,False,1,tensorop,f32,64,64,32,1,1,1,0,0,0,2,2,2,1,16,8,8,75,1024,200,132,0,0.004352,0.0427998,0.0303309
514,CUTLASS,gemm,cutlass_tensorop_s1688gemm_f16_64x64_32x2_nn_align1,passed,success,universal,2,1,64,f16:column,f16:column,f32:column,f32:column,1,0,serial,1,1,heuristic,invalid,invalid,False,False,1,tensorop,f32,64,64,32,1,1,1,0,0,0,2,2,2,1,16,8,8,75,1024,392,260,0,0.00513024,0.0711621,0.0506799
770,CUTLASS,gemm,cutlass_tensorop_s1688gemm_f16_64x64_32x2_nn_align2,passed,success,universal,2,1,128,f16:column,f16:column,f32:column,f32:column,1,0,serial,1,1,heuristic,invalid,invalid,False,False,1,tensorop,f32,64,64,32,1,1,1,0,0,0,2,2,2,1,16,8,8,75,1024,776,516,0,0.00594944,0.121475,0.0867309
1026,CUTLASS,gemm,cutlass_tensorop_s16816gemm_f16_64x64_64x5_nn_align2,passed,success,universal,2,1,256,f16:column,f16:column,f32:column,f32:column,1,0,serial,1,1,heuristic,invalid,invalid,False,False,1,tensorop,f32,64,64,64,1,1,1,0,0,0,5,2,2,1,16,8,16,80,1024,1544,1028,0,0.00777216,0.185014,0.132267
1282,CUTLASS,gemm,cutlass_tensorop_s16816gemm_f16_64x64_64x5_nn_align2,passed,success,universal,2,1,512,f16:column,f16:column,f32:column,f32:column,1,0,serial,1,1,heuristic,invalid,invalid,False,False,1,tensorop,f32,64,64,64,1,1,1,0,0,0,5,2,2,1,16,8,16,80,1024,3080,2052,0,0.0098816,0.290284,0.207659
1538,CUTLASS,gemm,cutlass_tensorop_s16816gemm_f16_64x64_64x5_nn_align2,passed,success,universal,2,1,1024,f16:column,f16:column,f32:column,f32:column,1,0,serial,1,1,heuristic,invalid,invalid,False,False,1,tensorop,f32,64,64,64,1,1,1,0,0,0,5,2,2,1,16,8,16,80,1024,6152,4100,0,0.0129126,0.443712,0.317518
1794,CUTLASS,gemm,cutlass_tensorop_s16816gemm_f16_64x64_64x5_nn_align2,passed,success,universal,2,1,2048,f16:column,f16:column,f32:column,f32:column,1,0,serial,1,1,heuristic,invalid,invalid,False,False,1,tensorop,f32,64,64,64,1,1,1,0,0,0,5,2,2,1,16,8,16,80,1024,12296,8196,0,0.0202854,0.56452,0.404034
2,CUTLASS,gemm,cutlass_tensorop_s16816gemm_f16_64x64_64x5_nn_align2,passed,success,universal,2,1,4096,f16:column,f16:column,f32:column,f32:column,1,0,serial,1,1,heuristic,invalid,invalid,False,False,1,tensorop,f32,64,64,64,1,1,1,0,0,0,5,2,2,1,16,8,16,80,1024,24584,16388,0,0.0339251,0.674887,0.483064
258,CUTLASS,gemm,cutlass_tensorop_s16816gemm_f16_64x64_64x5_nn_align2,passed,success,universal,2,1,8192,f16:column,f16:column,f32:column,f32:column,1,0,serial,1,1,heuristic,invalid,invalid,False,False,1,tensorop,f32,64,64,64,1,1,1,0,0,0,5,2,2,1,16,8,16,80,1024,49160,32772,0,0.061993,0.738533,0.528641
514,CUTLASS,gemm,cutlass_tensorop_s16816gemm_f16_64x64_64x5_nn_align2,passed,success,universal,2,1,12288,f16:column,f16:column,f32:column,f32:column,1,0,serial,1,1,heuristic,invalid,invalid,False,False,1,tensorop,f32,64,64,64,1,1,1,0,0,0,5,2,2,1,16,8,16,80,1024,73736,49156,0,0.0901939,0.761382,0.545003
770,CUTLASS,gemm,cutlass_tensorop_s16816gemm_f16_64x64_64x5_nn_align2,passed,success,universal,2,1,16384,f16:column,f16:column,f32:column,f32:column,1,0,serial,1,1,heuristic,invalid,invalid,False,False,1,tensorop,f32,64,64,64,1,1,1,0,0,0,5,2,2,1,16,8,16,80,1024,98312,65540,0,0.117873,0.776772,0.556024
18,CUTLASS,gemm,cutlass_tensorop_s1688gemm_f16_64x64_32x2_nn_align2,passed,success,universal,2,2,16,f16:column,f16:column,f32:column,f32:column,1,0,serial,1,1,heuristic,invalid,invalid,False,False,1,tensorop,f32,64,64,32,1,1,1,0,0,0,2,2,2,1,16,8,8,75,1024,144,136,0,0.00417792,0.0320998,0.0325521
274,CUTLASS,gemm,cutlass_tensorop_s1688gemm_f16_64x64_32x2_nn_align1,passed,success,universal,2,2,32,f16:column,f16:column,f32:column,f32:column,1,0,serial,1,1,heuristic,invalid,invalid,False,False,1,tensorop,f32,64,64,32,1,1,1,0,0,0,2,2,2,1,16,8,8,75,1024,272,264,0,0.00466944,0.0542506,0.0565378
530,CUTLASS,gemm,cutlass_tensorop_s1688gemm_f16_64x64_32x2_nn_align1,passed,success,universal,2,2,64,f16:column,f16:column,f32:column,f32:column,1,0,serial,1,1,heuristic,invalid,invalid,False,False,1,tensorop,f32,64,64,32,1,1,1,0,0,0,2,2,2,1,16,8,8,75,1024,528,520,0,0.00520192,0.0945302,0.0999631
786,CUTLASS,gemm,cutlass_tensorop_s1688gemm_f16_64x64_32x2_nn_align2,passed,success,universal,2,2,128,f16:column,f16:column,f32:column,f32:column,1,0,serial,1,1,heuristic,invalid,invalid,False,False,1,tensorop,f32,64,64,32,1,1,1,0,0,0,2,2,2,1,16,8,8,75,1024,1040,1032,0,0.00643072,0.150617,0.16048
1042,CUTLASS,gemm,cutlass_tensorop_s16816gemm_f16_64x64_64x5_nn_align2,passed,success,universal,2,2,256,f16:column,f16:column,f32:column,f32:column,1,0,serial,1,1,heuristic,invalid,invalid,False,False,1,tensorop,f32,64,64,64,1,1,1,0,0,0,5,2,2,1,16,8,16,80,1024,2064,2056,0,0.00771072,0.249296,0.266642
